[
  {
    "attributes": {
      "version": "0.1"
    },
    "files": [
      "sd/Programmbausteine/GDB.s7dcl",
      "sd/Programmbausteine/GDB.s7res"
    ],
    "folder": "Programmbausteine",
    "kind": "DB",
    "name": "GDB",
    "number": 1
  },
  {
    "attributes": {
      "version": "0.1"
    },
    "files": [
      "sd/Programmbausteine/FB_1_Sequence.s7dcl",
      "sd/Programmbausteine/FB_1_Sequence.s7res"
    ],
    "folder": "Programmbausteine",
    "kind": "FB",
    "language": "FBD",
    "name": "FB_1_Sequence",
    "number": 2
  },
  {
    "attributes": {
      "version": "0.1"
    },
    "files": [
      "sd/Programmbausteine/FB_2_Filling.s7dcl",
      "sd/Programmbausteine/FB_2_Filling.s7res"
    ],
    "folder": "Programmbausteine",
    "kind": "FB",
    "language": "FBD",
    "name": "FB_2_Filling",
    "number": 3
  },
  {
    "attributes": {
      "version": "0.1"
    },
    "files": [
      "sd/Programmbausteine/FB_3_Simulation.s7dcl",
      "sd/Programmbausteine/FB_3_Simulation.s7res"
    ],
    "folder": "Programmbausteine",
    "kind": "FB",
    "language": "FBD",
    "name": "FB_3_Simulation",
    "number": 4
  },
  {
    "attributes": {
      "version": "0.1"
    },
    "files": [
      "sd/Programmbausteine/FB_4_CIP_Simulation.s7dcl",
      "sd/Programmbausteine/FB_4_CIP_Simulation.s7res"
    ],
    "folder": "Programmbausteine",
    "kind": "FB",
    "language": "FBD",
    "name": "FB_4_CIP_Simulation",
    "number": 6
  },
  {
    "attributes": {
      "version": "0.1"
    },
    "files": [
      "sd/Programmbausteine/FB_Generate_Serial_Number.s7dcl",
      "sd/Programmbausteine/FB_Generate_Serial_Number.s7res"
    ],
    "folder": "Programmbausteine",
    "kind": "FB",
    "language": "LAD",
    "name": "FB_Generate_Serial_Number",
    "number": 1
  },
  {
    "attributes": {
      "version": "2.1"
    },
    "files": [
      "sd/Programmbausteine/LSim_I.s7dcl",
      "sd/Programmbausteine/LSim_I.s7res"
    ],
    "folder": "Programmbausteine",
    "kind": "FB",
    "language": "SCL",
    "name": "LSim_I",
    "number": 56
  },
  {
    "attributes": {
      "version": "2.1"
    },
    "files": [
      "sd/Programmbausteine/LSim_PT1.s7dcl",
      "sd/Programmbausteine/LSim_PT1.s7res"
    ],
    "folder": "Programmbausteine",
    "kind": "FB",
    "language": "SCL",
    "name": "LSim_PT1",
    "number": 50
  },
  {
    "attributes": {
      "version": "2.1"
    },
    "files": [
      "sd/Programmbausteine/LSim_PT3.s7dcl",
      "sd/Programmbausteine/LSim_PT3.s7res"
    ],
    "folder": "Programmbausteine",
    "kind": "FB",
    "language": "SCL",
    "name": "LSim_PT3",
    "number": 54
  },
  {
    "attributes": {
      "version": "0.1"
    },
    "files": [
      "sd/Programmbausteine/FC_1_Random_Number.s7dcl"
    ],
    "folder": "Programmbausteine",
    "kind": "FC",
    "language": "SCL",
    "name": "FC_1_Random_Number",
    "number": 3
  },
  {
    "attributes": {
      "version": "0.1"
    },
    "files": [
      "sd/Programmbausteine/FC_2_GetStringSizeOfNumber.s7dcl"
    ],
    "folder": "Programmbausteine",
    "kind": "FC",
    "language": "SCL",
    "name": "FC_2_GetStringSizeOfNumber",
    "number": 1
  },
  {
    "attributes": {
      "author": "Siemens_Digital_Industry",
      "family": "LGF",
      "version": "0.0.0.0"
    },
    "files": [
      "sd/Programmbausteine/LGF/06 Converter operations/LGF_DTLToString_ISO.s7dcl",
      "sd/Programmbausteine/LGF/06 Converter operations/LGF_DTLToString_ISO.s7res"
    ],
    "folder": "Programmbausteine/LGF/06 Converter operations",
    "kind": "FC",
    "language": "SCL",
    "name": "LGF_DTLToString_ISO",
    "number": 10083
  },
  {
    "attributes": {
      "version": "0.1"
    },
    "files": [
      "sd/Programmbausteine/DB_1_Sequence.s7dcl"
    ],
    "folder": "Programmbausteine",
    "kind": "IDB",
    "name": "DB_1_Sequence",
    "number": 2
  },
  {
    "attributes": {
      "version": "0.1"
    },
    "files": [
      "sd/Programmbausteine/DB_2_Filling_DB.s7dcl"
    ],
    "folder": "Programmbausteine",
    "kind": "IDB",
    "name": "DB_2_Filling_DB",
    "number": 3
  },
  {
    "attributes": {
      "version": "0.1"
    },
    "files": [
      "sd/Programmbausteine/DB_3_Simulation.s7dcl"
    ],
    "folder": "Programmbausteine",
    "kind": "IDB",
    "name": "DB_3_Simulation",
    "number": 4
  },
  {
    "attributes": {
      "version": "0.1"
    },
    "files": [
      "sd/Programmbausteine/DB_4_CIP_Simulation.s7dcl"
    ],
    "folder": "Programmbausteine",
    "kind": "IDB",
    "name": "DB_4_CIP_Simulation",
    "number": 11
  },
  {
    "attributes": {
      "version": "0.1"
    },
    "files": [
      "sd/Programmbausteine/DB_5_CIP_Simulation_Graph.s7dcl"
    ],
    "folder": "Programmbausteine",
    "kind": "IDB",
    "name": "DB_5_CIP_Simulation_Graph",
    "number": 14
  },
  {
    "attributes": {
      "version": "0.1"
    },
    "files": [
      "sd/Programmbausteine/Generate_Serial_Number_DB.s7dcl"
    ],
    "folder": "Programmbausteine",
    "kind": "IDB",
    "name": "Generate_Serial_Number_DB",
    "number": 6
  },
  {
    "attributes": {
      "version": "0.1"
    },
    "files": [
      "sd/Programmbausteine/Cyclic interrupt.s7dcl",
      "sd/Programmbausteine/Cyclic interrupt.s7res"
    ],
    "folder": "Programmbausteine",
    "kind": "OB",
    "language": "FBD",
    "name": "Cyclic interrupt",
    "number": 30
  },
  {
    "attributes": {
      "version": "0.1"
    },
    "files": [
      "sd/Programmbausteine/Main.s7dcl",
      "sd/Programmbausteine/Main.s7res"
    ],
    "folder": "Programmbausteine",
    "kind": "OB",
    "language": "LAD",
    "name": "Main",
    "number": 1
  },
  {
    "files": [
      "sd/PLC-Datentypen/typeApp.s7dcl",
      "sd/PLC-Datentypen/typeApp.s7res"
    ],
    "folder": "PLC-Datentypen",
    "kind": "UDT",
    "name": "typeApp"
  },
  {
    "files": [
      "sd/PLC-Datentypen/typeCIP.s7dcl",
      "sd/PLC-Datentypen/typeCIP.s7res"
    ],
    "folder": "PLC-Datentypen",
    "kind": "UDT",
    "name": "typeCIP"
  },
  {
    "files": [
      "sd/PLC-Datentypen/typeError.s7dcl",
      "sd/PLC-Datentypen/typeError.s7res"
    ],
    "folder": "PLC-Datentypen",
    "kind": "UDT",
    "name": "typeError"
  },
  {
    "files": [
      "sd/PLC-Datentypen/typeHmi.s7dcl",
      "sd/PLC-Datentypen/typeHmi.s7res"
    ],
    "folder": "PLC-Datentypen",
    "kind": "UDT",
    "name": "typeHmi"
  },
  {
    "files": [
      "sd/PLC-Datentypen/typeInfo.s7dcl",
      "sd/PLC-Datentypen/typeInfo.s7res"
    ],
    "folder": "PLC-Datentypen",
    "kind": "UDT",
    "name": "typeInfo"
  },
  {
    "files": [
      "sd/PLC-Datentypen/typeModel.s7dcl",
      "sd/PLC-Datentypen/typeModel.s7res"
    ],
    "folder": "PLC-Datentypen",
    "kind": "UDT",
    "name": "typeModel"
  },
  {
    "files": [
      "sd/PLC-Datentypen/typeOperate.s7dcl",
      "sd/PLC-Datentypen/typeOperate.s7res"
    ],
    "folder": "PLC-Datentypen",
    "kind": "UDT",
    "name": "typeOperate"
  },
  {
    "files": [
      "sd/PLC-Datentypen/typeProcess.s7dcl",
      "sd/PLC-Datentypen/typeProcess.s7res"
    ],
    "folder": "PLC-Datentypen",
    "kind": "UDT",
    "name": "typeProcess"
  },
  {
    "files": [
      "sd/PLC-Datentypen/typeSignals.s7dcl",
      "sd/PLC-Datentypen/typeSignals.s7res"
    ],
    "folder": "PLC-Datentypen",
    "kind": "UDT",
    "name": "typeSignals"
  },
  {
    "files": [
      "sd/PLC-Datentypen/typeState.s7dcl",
      "sd/PLC-Datentypen/typeState.s7res"
    ],
    "folder": "PLC-Datentypen",
    "kind": "UDT",
    "name": "typeState"
  }
]
